{
  "schema_name": "compute_comm_supplement_profile",
  "schema_version": "2.0.0",
  "profile_id": "aeroworld_compute_comm_supplement_v1",
  "semantics_scope": "simulated_derived_compute_communication_supplement",
  "decision_layer_included": false,
  "default_input_root": "aw_data/render_ready_episodes_capture_filtered",
  "default_output_root": "aw_data/compute_comm_supplement",
  "model": {
    "model_id": "aeroworld_discrete_compute_comm_sim",
    "model_version": "1.6.0",
    "seed_namespace": "profile_whitelisted_model_input_digest_v3"
  },
  "inputs": {
    "episode_manifest": "episode_manifest.json",
    "entity_roster": "global_entity_roster.json",
    "truth_frames": "truth_frames.jsonl",
    "weather": "weather_meta.jsonl"
  },
  "authoritative_tick_policy": {
    "start": 0,
    "end": 900,
    "step": 5,
    "adjacency": "exact_step"
  },
  "source_policy": {
    "authoritative_inputs": [
      "episode_manifest.json",
      "global_entity_roster.json",
      "truth_frames.jsonl",
      "weather_meta.jsonl"
    ],
    "forbidden_inputs": [
      "event_trace.jsonl",
      "event_realization.jsonl",
      "dynamic_labels.jsonl",
      "scenario_plan.json",
      "source_event_script_path",
      "n_events"
    ],
    "model_input_fields": [
      "episode_manifest.tick_hz",
      "episode_manifest.time_range.tick_start",
      "episode_manifest.time_range.tick_end",
      "episode_manifest.time_range.sim_time_start",
      "episode_manifest.time_range.sim_time_end",
      "global_entity_roster.entities[].entity_id",
      "global_entity_roster.entities[].entity_category",
      "global_entity_roster.entities[].entity_kind",
      "global_entity_roster.entities[].truth_pose.position_enu_m",
      "global_entity_roster.entities[].initial_position_enu_m",
      "truth_frames.tick",
      "truth_frames.entities[].entity_id",
      "truth_frames.entities[].entity_category",
      "truth_frames.entities[].entity_kind",
      "truth_frames.entities[].truth_pose.position_enu_m",
      "truth_frames.entities[].truth_pose.velocity_enu_mps",
      "truth_frames.entities[].communication_state.station_unavailable",
      "truth_frames.entities[].communication_state.communication_unavailable",
      "truth_frames.entities[].communication_state.available",
      "truth_frames.entities[].communication_state.link_available",
      "truth_frames.entities[].communication_state.availability",
      "truth_frames.entities[].communication_state.mode",
      "truth_frames.entities[].communication_state.handover_active",
      "truth_frames.entities[].security_state.jamming",
      "truth_frames.entities[].security_state.jamming_active",
      "truth_frames.entities[].security_state.gcs_compromised",
      "truth_frames.entities[].annotations.speed_mps",
      "truth_frames.entities[].sumo_vehicle.speed_mps",
      "weather_meta.tick",
      "weather_meta.condition",
      "weather_meta.rain",
      "weather_meta.fog_density",
      "weather_meta.dust",
      "weather_meta.wind_speed"
    ],
    "forbidden_manifest_fields": [
      "artifacts.event_trace",
      "artifacts.event_realization",
      "artifacts.dynamic_labels",
      "scenario_plan",
      "source_event_script_path",
      "n_events"
    ],
    "missing_parameter_policy": "unknown_with_missing_source_record",
    "authored_event_labels_are_fact_source": false
  },
  "parameter_governance": {
    "review_status": "reviewed_for_controlled_simulation",
    "measurement_provenance": {
      "hardware_logs_present": false,
      "network_logs_present": false
    },
    "source_class": "standard_referenced_parameter",
    "permitted_uses": [
      "controlled_simulation_sensitivity_analysis",
      "source_separated_baseline_training"
    ],
    "forbidden_claims": [
      "measured_hardware_performance",
      "measured_network_performance",
      "real_world_generalization"
    ],
    "references": [
      {
        "document_id": "3GPP TR 36.885 (Release 14)",
        "title": "Study on LTE-based V2X Services",
        "publisher": "3GPP",
        "year": 2016,
        "anchors": [
          {
            "group": "communication_channel",
            "parameter": "communication.station_profiles.base_station.nominal_range_m",
            "value": 350.0,
            "mapping": "urban V2X scenario inter-site distance (ISD) 350 m used as nominal station range"
          }
        ]
      },
      {
        "document_id": "3GPP TR 36.912 (Release 15)",
        "title": "Feasibility Study for Further Advancements for E-UTRA (LTE-Advanced)",
        "publisher": "3GPP",
        "year": 2018,
        "anchors": [
          {
            "group": "communication_channel",
            "parameter": "communication.channel.nominal_latency_ms",
            "value": 20.0,
            "mapping": "one-way RAN user-plane latency target 20 ms used as nominal channel latency"
          }
        ]
      },
      {
        "document_id": "3GPP TS 22.125 (Release 16)",
        "title": "Uncrewed Aerial System (UAS) support in 3GPP",
        "publisher": "3GPP",
        "year": 2019,
        "anchors": [
          {
            "group": "communication_channel",
            "parameter": "communication.flow_profiles.uav.bandwidth_mbps",
            "value": 12.0,
            "mapping": "telemetry/control/video-keyframe aggregate flow within UAS service data-rate order of magnitude"
          }
        ]
      },
      {
        "document_id": "3GPP TS 36.321 (Release 16)",
        "title": "E-UTRA; Medium Access Control (MAC) protocol specification",
        "publisher": "3GPP",
        "year": 2021,
        "anchors": [
          {
            "group": "retransmission",
            "parameter": "mechanism",
            "value": "harq_rlc_am",
            "mapping": "retransmission mechanism modeled after HARQ/RLC AM; deterministic count and floor are profile-declared"
          }
        ]
      },
      {
        "document_id": "3GPP TS 36.331 (Release 16)",
        "title": "E-UTRA; Radio Resource Control (RRC) protocol specification",
        "publisher": "3GPP",
        "year": 2021,
        "anchors": [
          {
            "group": "communication_channel",
            "parameter": "communication.handover_policy.handover_margin_m",
            "value": 15.0,
            "mapping": "distance-domain proxy for the A3 event offset/hysteresis trigger; offset value profile-declared"
          }
        ]
      },
      {
        "document_id": "NVIDIA Jetson Orin NX Datasheet",
        "title": "Jetson Orin NX Series System-on-Module Datasheet",
        "publisher": "NVIDIA",
        "year": 2022,
        "anchors": [
          {
            "group": "compute_capacity",
            "parameter": "compute.node_profiles.uav.cpu_cores",
            "value": 4.0,
            "mapping": "conservative sub-envelope of the 8-core Arm A78AE CPU; not measured on device"
          },
          {
            "group": "compute_capacity",
            "parameter": "compute.node_profiles.uav.gpu_units",
            "value": 1.0,
            "mapping": "normalized GPU unit as sub-envelope of the 1024-CUDA Ampere GPU"
          },
          {
            "group": "compute_capacity",
            "parameter": "compute.node_profiles.uav.memory_mb",
            "value": 4096.0,
            "mapping": "sub-envelope of the 8-16 GB LPDDR5 memory; not measured on device"
          }
        ]
      }
    ],
    "bandwidth_model": {
      "parameter": "communication.station_profiles.base_station.channel_bandwidth_mbps",
      "value": 80.0,
      "scope": "per_flow_nominal_cap",
      "external_numeric_basis": "unverified",
      "mapping": "Each UAV communication flow copies this profile value as nominal_capacity_mbps; its own capacity_factor sets effective capacity_mbps. No station aggregate budget is modeled."
    },
    "parameter_groups": {
      "compute_capacity": {
        "status": "standard_referenced_parameter",
        "basis": "device-spec-referenced envelope: UAV node uses a conservative NVIDIA Jetson Orin NX-class edge-AI sub-profile; vehicle node uses an automotive ADAS/cockpit SoC-class sub-envelope",
        "sensitivity_required": true
      },
      "compute_task_demand": {
        "status": "deterministic_simulation",
        "basis": "controlled perception, navigation, and onboard video workload tiers cover 3.8 to more than 8 CPU cores; speed scaling represents motion-planning growth and the declared peak window exercises queue behavior",
        "sensitivity_required": true
      },
      "communication_channel": {
        "status": "standard_referenced_parameter",
        "basis": "3GPP-referenced discrete urban LTE/V2X baseline: TR 36.885 urban deployment (350 m ISD, 20 MHz), TR 36.912 one-way user-plane latency target (20 ms), TS 22.125 UAS service class; the 80 Mbps per-flow cap and latency/packet-loss envelopes are profile-declared model inputs without a verified external numeric basis",
        "sensitivity_required": true
      },
      "station_operational_state": {
        "status": "deterministic_simulation",
        "basis": "controlled conversion from structured communication and security state to operational capacity, range, availability, and quality factors",
        "sensitivity_required": true
      },
      "weather_attenuation": {
        "status": "standard_referenced_parameter",
        "basis": "bounded condition coefficients follow the ITU-R P.838 rain-attenuation relationship and are mapped into the discrete channel model",
        "sensitivity_required": true
      },
      "retransmission": {
        "status": "standard_referenced_parameter",